[
  {
    "id": "t0000000-0000-0000-0000-000000000201",
    "taskCode": "TSK-ENG-DEL-201",
    "department": "ENGINEERING",
    "title": "Deep Ballast Tamping & Track Realignment",
    "description": "Routine mechanized track tamping and ballast compaction on KM 412 Down Line.",
    "assetId": "a0000000-0000-0000-0000-000000000101",
    "corridorId": "c0000000-0000-0000-0000-000000000001",
    "status": "PLANNED",
    "priority": "HIGH",
    "estimatedDurationMinutes": 180,
    "startTimeWindow": "2026-09-25T02:00:00Z",
    "endTimeWindow": "2026-09-25T05:00:00Z",
    "requiredResources": ["Heavy Rail Crane RC-01", "Ballast Tamper Gang-04"],
    "sourceSystem": "BDMS",
    "sourceRecordId": "BDMS-TSK-8801",
    "ingestedAt": "2026-09-24T00:00:00Z",
    "updatedAt": "2026-09-24T00:00:00Z"
  },
  {
    "id": "t0000000-0000-0000-0000-000000000202",
    "taskCode": "TSK-SIG-DEL-202",
    "department": "SIGNAL_TELECOMMUNICATION",
    "title": "Electronic Interlocking Software & Sensor Calibration",
    "description": "Preventive inspection and track circuit sensor testing at Aligarh Outer S-42.",
    "assetId": "a0000000-0000-0000-0000-000000000102",
    "corridorId": "c0000000-0000-0000-0000-000000000001",
    "status": "PLANNED",
    "priority": "MEDIUM",
    "estimatedDurationMinutes": 120,
    "startTimeWindow": "2026-09-25T02:30:00Z",
    "endTimeWindow": "2026-09-25T04:30:00Z",
    "requiredResources": ["S&T Inspection Van-02", "Telecom Crew Alpha"],
    "sourceSystem": "SMMS",
    "sourceRecordId": "SMMS-TSK-4412",
    "ingestedAt": "2026-09-24T00:00:00Z",
    "updatedAt": "2026-09-24T00:00:00Z"
  },
  {
    "id": "t0000000-0000-0000-0000-000000000203",
    "taskCode": "TSK-TRC-DEL-203",
    "department": "TRACTION",
    "title": "OHE Overhead Wire Tension Adjustment & Insulator Replacement",
    "description": "Routine overhead electric wire inspection and replacement of flashover insulator.",
    "assetId": "a0000000-0000-0000-0000-000000000103",
    "corridorId": "c0000000-0000-0000-0000-000000000001",
    "status": "PLANNED",
    "priority": "MEDIUM",
    "estimatedDurationMinutes": 150,
    "startTimeWindow": "2026-09-25T02:15:00Z",
    "endTimeWindow": "2026-09-25T04:45:00Z",
    "requiredResources": ["Tower Wagon TW-04", "TRD Linesmen Rake"],
    "sourceSystem": "TDMS",
    "sourceRecordId": "TDMS-TSK-9903",
    "ingestedAt": "2026-09-24T00:00:00Z",
    "updatedAt": "2026-09-24T00:00:00Z"
  },
  {
    "id": "t0000000-0000-0000-0000-000000000204",
    "taskCode": "TSK-ENG-HWH-204",
    "department": "ENGINEERING",
    "title": "Emergency Rail Joint Replacement & Thermit Welding",
    "description": "Immediate emergency repair of cracked insulated rail joint J-90. Overdue by 48 hours.",
    "assetId": "a0000000-0000-0000-0000-000000000104",
    "corridorId": "c0000000-0000-0000-0000-000000000002",
    "status": "OVERDUE",
    "priority": "CRITICAL",
    "estimatedDurationMinutes": 240,
    "startTimeWindow": "2026-09-24T01:00:00Z",
    "endTimeWindow": "2026-09-24T05:00:00Z",
    "requiredResources": ["Heavy Rail Crane RC-01", "Welding Crew Delta"],
    "sourceSystem": "BDMS",
    "sourceRecordId": "BDMS-TSK-1004",
    "ingestedAt": "2026-09-24T00:00:00Z",
    "updatedAt": "2026-09-24T00:00:00Z"
  },
  {
    "id": "t0000000-0000-0000-0000-000000000205",
    "taskCode": "TSK-ENG-BPL-205",
    "department": "ENGINEERING",
    "title": "Major Turnout Replacement at Bhopal North Junction",
    "description": "Complex point switch turnout overhaul needing 6 continuous hours. Available train-free window is only 90 minutes.",
    "assetId": "a0000000-0000-0000-0000-000000000106",
    "corridorId": "c0000000-0000-0000-0000-000000000003",
    "status": "REQUESTED",
    "priority": "HIGH",
    "estimatedDurationMinutes": 360,
    "startTimeWindow": "2026-09-25T01:00:00Z",
    "endTimeWindow": "2026-09-25T02:30:00Z",
    "requiredResources": ["Track Crane TC-09", "P-Way Gang 12"],
    "sourceSystem": "BDMS",
    "sourceRecordId": "BDMS-TSK-3005",
    "ingestedAt": "2026-09-24T00:00:00Z",
    "updatedAt": "2026-09-24T00:00:00Z"
  },
  {
    "id": "t0000000-0000-0000-0000-000000000206",
    "taskCode": "TSK-ENG-LKO-206",
    "department": "ENGINEERING",
    "title": "Diesel Spur Wooden Sleeper Replacement",
    "description": "Manual sleeper replacement on non-electrified Lucknow-Gonda spur. Cannot share electrical/traction blocks.",
    "assetId": "a0000000-0000-0000-0000-000000000105",
    "corridorId": "c0000000-0000-0000-0000-000000000004",
    "status": "PLANNED",
    "priority": "LOW",
    "estimatedDurationMinutes": 180,
    "startTimeWindow": "2026-09-25T06:00:00Z",
    "endTimeWindow": "2026-09-25T09:00:00Z",
    "requiredResources": ["Manual Sleeper Gang 03"],
    "sourceSystem": "BDMS",
    "sourceRecordId": "BDMS-TSK-4006",
    "ingestedAt": "2026-09-24T00:00:00Z",
    "updatedAt": "2026-09-24T00:00:00Z"
  }
]
